{
  "schemaVersion": 1,
  "registryId": "bobocloud.marketplace",
  "updatedAt": "2026-08-25T00:56:19+08:00",
  "format": {
    "shardPath": "indexes/<shard>.json",
    "packagePath": "packages/<publisher>/<name>/index.json",
    "versionPath": "packages/<publisher>/<name>/versions/<semver>.json"
  },
  "policy": {
    "packageIdPattern": "^[a-z0-9](?:[a-z0-9-]*[a-z0-9])?\\.[a-z0-9](?:[a-z0-9-]*[a-z0-9])?$",
    "artifactProtocol": "https",
    "artifactHosts": [
      "raw.githubusercontent.com"
    ],
    "artifactDigest": "sha256",
    "immutableVersionDocuments": true
  },
  "shards": [
    {
      "id": "official",
      "path": "indexes/official.json",
      "sha256": "b582afed34eb285bed76823f92b2cd3495d194dc0ba79272f9e062f3089ddc52",
      "count": 3
    }
  ]
}
